{"schema_version":"v1","id":"wp-v2-000","kind":"work-packet","created_at":"2026-08-22T00:00:00Z","correlation_id":"v2-bootstrap","task_id":"V2-000","objective":"Establish v2 execution baseline","scope":["repository","worktree","environment"],"inputs":["execution preflight"],"instructions":["Use the dedicated v2 worktree"],"acceptance":["Baseline is reproducible"]}
