{"schema_version":"v1","id":"wp-v2-001","kind":"work-packet","created_at":"2026-08-22T00:00:00Z","correlation_id":"v2-bootstrap","task_id":"V2-001","objective":"Record v2 product and architecture boundaries","scope":["docs"],"inputs":["v2 design baseline"],"instructions":["Keep contracts provider-neutral"],"acceptance":["Boundary documents exist"]}
